{"formal_spec":{"result_sha256":"3333333333333333333333333333333333333333333333333333333333333333","review_sha256":"4444444444444444444444444444444444444444444444444444444444444444","specification_sha256":"2222222222222222222222222222222222222222222222222222222222222222","status":"pass"},"future_requests":[{"ar_ref":"AR-0065","classification":"new-ar","reason":"capture end-to-end discussion integration","request_sha256":"5555555555555555555555555555555555555555555555555555555555555555"},{"ar_ref":null,"classification":"rejected","reason":"provider execution is out of scope","request_sha256":"6666666666666666666666666666666666666666666666666666666666666666"}],"journal_id":"JOURNAL-AR0064-001","kind":"discussion-persistence","limitations":["bounded_journal_shape_only","filesystem_crash_guarantees_not_proven","user_intent_not_proven","provider_and_network_execution_out_of_scope","consumer_native_gates_remain_authoritative"],"points":[{"id":"POINT-AR0064-1","proposals":[{"id":"PROP-AR0064-1-A","summary":"Persist all decisions","evaluation":"digest-only"}],"response":{"disposition":"select","proposal_id":"PROP-AR0064-1-A","user_proposal":null},"unresolved":false},{"id":"POINT-AR0064-2","proposals":[{"id":"PROP-AR0064-2-A","summary":"Re-ask unresolved points","evaluation":"digest-only"}],"response":{"disposition":"request-clarification","proposal_id":null,"user_proposal":"digest-only"},"unresolved":true}],"privacy_projection":{"projection_sha256":"7777777777777777777777777777777777777777777777777777777777777777","public_safe":true,"redacted_fields":["prompt","transcript","credentials","private_paths"]},"reask":{"point_ids":["POINT-AR0064-2"],"reason":"clarification required","required":true},"resume_revision":2,"revision":2,"safe_exit":{"atomic":true,"commit_sha256":"8888888888888888888888888888888888888888888888888888888888888888","complete":true,"saved":true},"schema_version":1,"status":"re-ask","task":{"id":"AR-0064","revision":2}}
